Question	Potentially_Pejorative
这个时候那些爱管闲事的上海大爷大妈怎么不出来骂人？骂上海话,噼里啪啦的口水喷了黑人一脸那才叫个爽啊[调皮][调皮][调皮][调皮][调皮][调皮]	Potentially
那么问题来了，女士优先和绅士风度到底算不算对女性的歧视？	Potentially
问题是非处女会骗人啊，这些女人不敢对自己的行为负责，你怎么看待处女膜修复手术呢？那难道不是我们这个礼仪之邦最虚伪的东西吗？	Potentially
你的数据支持呢？我说女性出轨率高于男性	Potentially
女的女的，你就这么歧视女性，你肯定是个?男的?吧	Potentially
你硬要扯性别矛盾，那你看看男司机撞死人多还是女司机呀，男杀人犯多还是女杀人犯多呀？ 劳烦你去微博和女拳打拳吧	Potentially
呵呵，老回说的没素质的东北人？老回说东北人整体素质低，这不是指的少部分人，而是攻击整个东北人群体	Potentially
你到底懂不懂什么叫群体歧视？你见过国外脱口秀白人说黑人都是垃圾的嘛？你见过国内脱口秀说女性都是垃圾的嘛？什么节目效果？她咋不敢说中国人都是垃圾呢？你让她说出来试试？怎么中国男的是好欺负？	Potentially
我觉得嫁给黑人的女人，都是自我逆向淘汰，和黑人离婚后，如果婚后有黑孩子，无论贫穷老幼哪个男人愿意接盘？如果没有黑孩子，恐怕年龄也超过30岁了，再加上有黑人婚史，哪个智力正常的男人愿意接盘，	Potentially
我不是河南人 为什么要强调下河南人？你这是地域歧视你的爸爸们吗？	Potentially
在歧视亚裔或华人问题上，是欧洲严重还是美国严重，各有什么特点？	Potentially
如果我选择坐在黑人旁边 难道我歧视白人？	Potentially
别说你一个男人了，我一个女人都想不通为什么她们一个个要嫁给黑人，难道个个都是奥巴马？还是曼德拉？	Potentially
台湾有台积电，你说他落后？我觉得只是有些人知硬而已	Potentially
不好看就是不好看，黑人嘴凸好看吗？就算不说美观问题，	Potentially
新疆人就是恐怖分子？	Potentially
这意思是要白piao，还要精神损失费，纳尼？来中国的老外大多什么阶层的心里要有b数，整天云diss国男，还要吸国男的血，杀人还要诛心啊，	Potentially
合着那些人就是主流？现实中有几个人敢这样大放厥词，搞种族歧视，有几个人说印度人越南人是劣等民族？	Potentially
男人都是骗子，他最后还不是开始送外卖了么？	Potentially
你知不知道每年有多少留美中国籍同胞受到你所谓的“弱者”的暴力歧视导致破产、残疾甚至死亡？在以美国为首的西方国家，最基础的歧视链就是：白人→黑人→以中国人为代表的亚裔黄种人另外，在大概13、14年的时候，	Potentially
为什么gay圈滥交这么严重？	Potentially
为什么非要倒贴呢？女人在日本地位很低微的	Potentially
其实我一直有个疑问，跟直男相对的不是弯么？为什么直男还有直男癌变成了一个贬义的词？意思是不是同性恋的都该骂么 到底啥意思	Potentially
这叫玻璃心？试问有中国人会在公开给黑人的某个节日祝福的视频里说祝各位黑鬼节日好的吗？真的无语	Potentially
香港别的不说，服务态度不是出了名的差？全世界发达地区还能找出一个像香港这样态度恶劣的地方？如果说仅仅歧视大陆人也就算了，香港那些餐饮店对本地人都一样黑口黑脸的，我想不出全世界稍微发达点的，有哪里是这种服务态度	Potentially
这么喜欢找国内问题的话，那就不要歧视黑人好咯，个个争做城市好cuck公，把女儿嫁过去彰显zz平等？每个国家都有歧视，所以被当地你高贵黑人歧视时倒是缩头了？就不能骂回去？	Potentially
鄙视混混可以，但别把北京老炮叫混混，老炮几十年前就收手了，跟电影里一样，有老师有老板有闲在家的，那个是你说的杀人放火的混混？你境界这么高敢问你是混北城还是南城的？跟谁混的？又见过那个？还是连电影都没琢磨懂？	Potentially
中国人没有使用暴力的权利，你想被关进去？	Potentially
有些女人看似抱怨实则在秀[飙泪笑][捂嘴]，真实一点不好撒？	Potentially
为什么现代中国男性受歧视的现象总被忽视？	Potentially
男男恶心，看这种文章的人是什么样子的？	Potentially
为什么国女不帮国男，你们心里没数吗？平时性别歧视的也是国男，打压女性生存空间的还是国男，	Potentially
谁踏马说东北人一定要打人了，谁啊？站出来	Potentially
全体云南人都会打人喽？	Potentially
你是印度人吗？还两个礼拜一起强奸案，无语	Potentially
卧槽，你们在说啥子？尼采不是嫖娼感染性病才仇视女人的？	Potentially
不觉得答主真的只讲女性的性别歧视吗？	Potentially
那美国对亚裔的歧视哪来的？	Potentially
你去试一下歧视黑人言论？	Potentially
为什么东北人就不能有优越感？就应该认同于地域黑的偏见然后自卑吗？	Potentially
呵呵，别扯这些有的没的，国内网络上提到黑人就满口黑鬼，你去美国大街上吼一嗓子，让人家理解一下试试？	Potentially
各位看到了吗，那个伊云说自己有别野有车~现在的女人真的到了有别野就嫁的地步了？	Potentially
同问，广东人有什么精神必须通过排外来表达？	Potentially
一个亚洲人找一个有严重种族歧视暴力倾向的白人，这和找死的区别在哪？	Potentially
对黑人种族歧视的主战场在美国，在中国乱发声的不是圣母婊是什么？黑人被歧视的根源是什么？如果真的反对种族歧视，反对歧视黑人，那么跑漂亮国去上街游行啊？跑非洲去援建一个瓦坎达啊？	Potentially
新成立一个防止亚裔被歧视的部门，不就是为了把黑白矛盾引向亚裔吗？	Potentially
女人要牢记，就在不远的时间之前，男人们还在科学研讨会上讨论，：女人是不是人？	Potentially
奇葩？ 男性都是垃圾 是侮辱语，这句话本身是客观存在，题主举报杨x侮辱全体男性有什么问题？如果你是男性，你已经被侮辱了，只不过你感觉迟钝或者比较麻木罢了	Potentially
黑豹怎么种族歧视了？人家原作就是黑人，还是说你不喜欢黑人发达了？	Potentially
女性专用车厢？真的有些恶心	Potentially
不还是因为地方经济落后那？浙江这里的拆二代多的不得了	Potentially
这是性别歧视，为啥女性角色就一定要靠色相，才能完成任务？	Potentially
你这理解真有意思？按你的说法美国黑人录取分数线低意思他们就不被歧视了？美国黑人是一等公民吗？	Potentially
为什么你会认为北非奴隶是黑人，美剧里黑人演员演的角色就是黑人呢？……	Potentially
白左可以让黑人种族歧视白人，就是不能亚裔歧视白人，逻辑？	Potentially
瞧不起我们新疆切糕？？？	Potentially
经常听闻黑人的负面消息，大家对其印象不好，见到了会讨厌，这不是很正常吗？假如你知道你身边某个普通朋友曾经是杀人犯，小偷之类的，你对他有戒心不也是正常吗？再打比方:中国人去国外旅游，乱丢垃圾，	Potentially
你们广东人去香港的时候受到香港人的接受吗？还是他们一样对你们歧视？香港人真的是狼吗？对自己内地的同胞很差？你们去那边时，改不改变你们的口音为了融入进他们的有香港特色的社会里？	Potentially
移民的把外地的名额占了，本地的考上个学校还天天说自己高考难，你们不如我云云，知道为啥河南人偷井盖了吗？	Potentially
怎么说呢？不是地域黑，山东男人大男子主义的特别多，就你说的这种很常见	Potentially
有素质就像日本人和台湾人了？	Potentially
我是真心希望歧视得越厉害越好，管特么白人黑人，全部当成下等人，凭什么只能人家歧视我们，我们就不能歧视人家？	Potentially
你们到底是不是在中国过读的书？这些东西有问题？九年义务教育语文和历史里都有啊，对日本是变态了点，	Potentially
你听说过十亿河南九亿骗总部设在驻马店吗？这是啥？这不是抹黑，污蔑驻马店形象?我指着你家里人说，你家里人都是小偷骗子，你会不会打我骂我?	Potentially
问题已重定向至 如何看待74岁中国老人在美国高犯罪社区的家门外被15岁黑人枪杀？（2017年）？ [图片] [图片]	Potentially
河北一所好大学也没有咯？太tm对了	Potentially
？？？？？你这是想把洋人歧视中国人的问题转化成中国男人女人之间的矛盾，作为中国女人，我也觉得这就是歧视啊，难不成欧洲人歧视亚洲人我们还会觉得高兴？	Potentially
答主是女的都有人骂直男癌，真不敢想象答主如果是男的会被喷成什么样子(?￣?,??,￣??)	Potentially
有坏人都承认，有坏人做坏事也不是不让说，但是直接带上所有人难道就对了？台湾人都是诈骗犯？上海人都小气？北京人都老炮？广西人都爱砍人？地图炮就不对了吧	Potentially
很有道理？那我喊“河南人都是小偷” 有没有道理？	Potentially
看到地域黑，真心遇到过……在三亚玩不小心钱包丢了，去失物招领处问，问我哪的，我说河南的，有一个工作人员说：啊 河南骗子最多啦 你怎么还丢钱包啊？？那我我去偷钱包才合理吗……我的错？？？	Potentially
哈哈，我们河南人偷井盖，别让我见到这种人，否则他家方圆十里的井盖电缆我全给他扯走（嘻嘻(?˙︶˙?)）	Potentially
天哪，男生和女生说话都这么难听吗？火气这么大，我说的是评论	Potentially
偷井盖的不是福建的？	Potentially
你这个观点先不说行业对女性加入有没有偏见正推可以反推男性懂 的都在计算机高校吗如果不是女性为什么一定要加入受歧视行业才能算懂 ？	Potentially
男的玩软辅犯罪呢？	Potentially
现在知乎好像不少人都说香港排外？	Potentially
果子哥哥重庆话：蜜汁吵架合集 2_哔哩哔哩 (゜-゜)つロ 干杯~-bilibili重庆人吵架是不是都这么乐？这吵得起来？	Potentially
伪女权总是存在的，你怎么知道真女权不发声？更何况你还没回答我之前的问题，直男癌那么多也没见哪个男人去骂，他们把中国男人的名声都搞坏了，懂吗	Potentially
你这瞎扯些什么玩意？？女人虐童不用负责了？？奇葩	Potentially
种族歧视这个词不就是老美搞出来的？我国又没压迫过黑人，现在倒是黑人来我国添乱，	Potentially
而且你说人家觉得东方落后是地理原因所以不算歧视，那我说河南人都偷井盖也不算歧视了？什么斯坦福教授，哈哈，我看也就一地域黑，水平还没斗鱼弹幕高呢	Potentially
河南经济落后？gdp不完爆你湖北？	Potentially
没人否认健康的亚洲人在体格，力量上弱于健康的黑人和白人吧？如果智商上又没有区别，那岂不是亚洲人变成最劣等的民族了？亚洲人机体上优势是什么？	Potentially
哪来的优越感啊？生个混血白娃一堆人夸好看，反过来歧视黑人？？？？？双标这招国人玩的一直很好，女生找黑人引以为耻，男生找黑妞就引以为傲？？？男的找个黑人老婆生的孩子黑不溜秋的都tm上新闻了，也没见人去谴责，	Potentially
这群给团长解释说心情不好的是哪里有问题吗心情不好朝别人撒气，黑人cd？？退一万步说，鲸鱼差你这一半的破工资？？想给这点工资就息事宁人实数恶心	Potentially
敢说中国是世界上没种族歧视的地方，在那个国家一个非洲来的穷屌丝能比本国高富帅都x伙伴多？	Potentially
你这种整天黑人家骂人家，人家拉黑你都不行？为黑而黑真没啥意思	Potentially
必须给黑人学生好成绩，否则就是种族歧视？	Potentially
肏你 算侮辱女性吗？就一个骂人的话，还想说多好听？	Potentially
没有这么黑人的，国民党连沈阳都到不了，还挺进到黑龙江纵兵抢劫？	Potentially
我觉得吧，说了这么多，评论里也有那么多观点，最重要的是，爸爸要参与，为什么不能有家庭妇男？男性的就业歧视本来就少，做家务带孩子力气也大，而且妈妈孩子都生好了，奶也产好了，做个全职丈夫带孩子一两年完全没问题吧？	Potentially
在北京查个身份证就是歧视了，特别对于劳动改造过的人员，没有回乡办证这种异常行为多问两句就是歧视了，都坐牢了，还是那么脆弱，至于吗？	Potentially
为什么叫这个男的渣男？ 渣男的定义是什么？ 渣男不是玩弄女性的感情或者身体吗？ 还是穷就是渣？还是小气吝啬就是渣？	Potentially
是不是骂人不是很明显么？如果我注册个公司叫“河南有井无盖有限公司”你觉得是不是骂人？	Potentially
现在某些女拳是打算搞文字狱吗？	Potentially
看你是学生吓唬你，咋的他杀人不犯法啊？在东北你试试，把刀放他手里他敢动一下?	Potentially
为什么对拉美裔有负罪感？排华法案，难道对华人不更应该有吗？	Potentially
福建重男轻女且大多男的都妈宝男，直男癌，了解一下？	Potentially
动不动就田园女权跟风好玩？那说你直男癌行不行？	Potentially
黑人被歧视没有怪罪非洲老家的国家如何落后 只是团结一心上街游行来争取平权 争取不被歧视 怎么到了这帮香蕉人这里就只会转头怪中国呢？ 我觉得楼主说的一点没错 自己窝里斗不适应美国国情不团结呐喊争取小团体利益 反而觉得是被中国拖累 这帮人死不足惜	Potentially
你自己看看你自己的回复噢 只能说东北人讲信用的人少 你歧视的是一个没道德的人还是一群人？睁着眼睛说虾滑？	Potentially
女生可以拖鞋男生就不行，几个意思？性别歧视吗	Potentially
您是靠什么评判是不是直男癌的？	Potentially
你说的难道不是因为欧美国家及日本歧视中国人低劣，中国人又嘲笑印度人低劣的循环么？	Potentially
那怎么没有处男情节啊？难道女人就不怕被染上病？	Potentially
那是不是把皮肤染成彩虹色，才不会有种族歧视呢？	Potentially
实际上你看看数据就知道，我们河南省无论是犯罪率还是其他，跟其他各省比都没什么突出的地方，怎么到了现实和网络上，河南省就变成了坏人遍地走的地方？这还不能反应一些问题吗？	Potentially
不严重啊，我们除了歧视黑人和白人和不是中国人的黄人还歧视谁?	Potentially
“黑人犯罪率高是不是因为他们天生蠢呢？”	Potentially
穿着西装的西方人在一百年前就只是对中国勒索和抢劫，穿着和服的日本人在中国烧杀抢掠屠城，数以千万计的中国人死在日本人手里，西方人在中国这样吗？西方在上海的租界救过多少中国人你知道吗	Potentially
只想请问是歧视黄种人还是歧视白种人还是歧视黑人？	Potentially
这个问题就等于 广西人偷井盖吗？ 广东人什么都吃吗？ 日本人变态吗？ 美国人霸道吗？	Potentially
“你作为男人不该多承担一些压力吗？	Potentially
拿谭谈交通里的升斗小民跟美利坚犯罪率奇高的黑人比？	Potentially
所以你认为黑人不劣等？	Potentially
又没有强迫本地人喝什么，自己喝个热水跟本地习惯有个卵关系，按你这么说，到四川旅游不吃个辣就不尊重四川人？	Potentially
你这说的，为什么女的可以挑男的这里那里不好，男的就不能挑女的，还说这是在挑男朋友，言外之意就是男的挑女的就是事多，女的挑男的就是应该？	Potentially
拐卖妇女，罪恶的来源应该是买家，人贩子不过是中介，没有买卖就没有伤害，没人敢买了，还有人贩子么？	Potentially
嗨哟我艹，地铁上打架了说不是上海人，地铁上挨骂的就一口咬定是上海人，怎么着现在地狱黑和双标还可以融合的吗？	Potentially
这个社会对女性的歧视，尤以农村为重，对于女生，能读书就供，学不了就嫁人，对于男生则要安排买房娶媳妇儿，未尽责任的你们生孩子是干嘛的？这种畸形文化让人觉得寒心，即便女儿在外受了欺负，作为父亲也只是马后炮的人后示威，要你这种父亲何用？	Potentially
说白了大家都是中国人，歧视整个中国了？况且广东这么大的省就没人杀人放火？	Potentially
老实人是最容易受欺负的，不是不说，说了你们也不信，校园暴力老师肯定有责任，估计是怕社会混混北京硬才会导致，至于家？那还是个家嘛？	Potentially
啧啧，又是男的呗，男的太贱？	Potentially
[捂脸]性别歧视？？时代变了,现在是女的歧视男的	Potentially
你们广东人是不是什么都吃？	Potentially
你把这些条件代入白人和黑人，这就是赤裸裸地公认的种族歧视，为啥这个东西换成了女性 你就认为这不是歧视不是压迫呢？这么双标？	Potentially
其实基本情况都看得懂，就是被贱男一家的逻辑弄懵了，难道不是应该不离就不引，离才引吗？黑人问号	Potentially
台湾就不算我国的了？中芯国际的问题在于光刻机？从落后一代到落后三代，很有可能准备四代，问题是光刻机？差的是光刻机？说白了华为的主要因素就是华为设计能力太差，也不愿意去主动去做，能买现成的干嘛要去自己花钱砸，国内都这样，就这破毛病	Potentially
nba敢公开歧视黑人？	Potentially
你是想说东北人都经不起时间考验，与之交往最终往往得到的是他们的自私自满自大的本性是吗？	Potentially
当然是白人的种族歧视啦，一开始歧视黑人，然后黑人报团儿了就怂了，不敢明目张胆地歧视了，然后就歧视黄种人，因为亚裔力量小（不知道从哪里看出来哗众取宠，明明弊大于利:)他们那一帮就感觉自己是白皮儿的就纯洁高贵了似的？	Potentially
还真不是，白人敢踹一下，歧视黑人的帽子扣上就完了，被老黑打死都不会有人帮他，不得歧视黑人在美国是政治正确，就算心里歧视嘴上绝对不敢说，你让白人在大街上叫声nigger试试？给他一百个胆都不敢	Potentially
'但是真想不懂为什么重男轻女的人觉得女孩子就是赔钱货？敢问你爸妈养你赔了多少钱？你还给他们没？？？''顶	Potentially
男女分厕所也是区别对待，这种区别是谁歧视了谁呢？	Potentially
到底是男是女？开头说是女生，垃圾佬那段说两个男人手牵手？？？？	Potentially
广东人，算南方吧？反正恶心他	Potentially
村民是否触犯了聚众阻碍解救被拐卖的妇女罪？	Potentially
意思东北人打老婆，下手有点黑是么？	Potentially
华为这次确实该骂 P10确实该抵制 但楼主你这样说三星和华为还是有点有失公允 三星怎么突然变成小白兔了？“总是背锅”？ （黑人问号脸） 华为还有自己的5G技术 专利一堆 也不差 三星在其他元件上有话语权 这都不是同一个竞争领域 不方便对比	Potentially
你以为黑人兄弟在国内不畅销么？知道为啥会有easy girl这种说法？	Potentially
为什的男同更容易艾滋？	Potentially
来来来，你跟我说国际上怎么称呼台湾的？恶心你就是恶心你	Potentially
这种女生确实有点恶心，不说男的，女生就一定要小心眼吗？一定要搞那些有的没的，这是人品问题了	Potentially
落后？ 怎么叫做落后啊 你指的到底是地方的录音 还是北京这边的 你要说北京这边的你是真的接触过这边的吗	Potentially
期待黑命贵向基督教开火--凭什么天使的翅膀是白色的，恶魔是黑色的？	Potentially
看到这个标题，估计很多人会说，为什么各个地方都有好人坏人，为啥河南就背锅偷井盖、小偷？	Potentially
光会挨打求饶的男人就会被看得起了？	Potentially
所以，社会更容易接受低学历女性当全职家庭主妇咯？	Potentially
而且，说起来，很久以前，歧视黑人，歧视女性，歧视XX是当时的政治正确，对吧？	Potentially
男人出轨呢？要不要毒死男的？	Potentially
北京人好吃懒做，上海人精明小气一毛不拔？	Potentially
男人不包二奶？	Potentially
哪还分行业啊，只因为我们是女的就已经被歧视了，不信看看我们区发的招聘要求，文秘特么的必须得男的？	Potentially
真恶心,嫁不出去了么？中国没男人？	Potentially
哪里歧视？是粤吹非要把粤语吹到凌驾所有方言的层次被人打脸就是歧视了？那广东人也太玻璃心了吧	Potentially
女人就不能强奸？	Potentially
你脱单了？哪个男的遇到你也是倒霉	Potentially
混圈到底有什么意思？幼稚又恶心，搞那些什么cp之类的模糊关系，周围就有很多所谓的混圈人，又有男女朋友又有所谓的cp，不就是脚踏两条船了吗	Potentially
那些低素质，扰乱社会的非中国人不能强制遣返，永久拉入入境黑名单吗？	Potentially
最烦这帮yp上海是他们建设的，赚不到钱他们会来？赚着上海的钱享受着上海的便利还要一边说这是他们建设的，还要嫌上海人排外，还不让上海人说上海话	Potentially
你的意思是美国人不用买房？美国人孩子不用高考？每个人都哈佛耶鲁常青藤，拿到美国户口就一辈子人上人了？那美国的红脖子闹啥？亚裔为啥要反对教育法案？	Potentially
说中国人有种族歧视这个问题不是没事找事吗，汉族本身就够被歧视了，还要被挂出来嘲讽?	Potentially
讲道理约炮最恶心的地方就是女的会比较脏让我觉得比较害怕什么？你问我男的就不脏我身为男性不用考虑这个问题谢谢	Potentially
河南人和东北人被歧视的时候你有站出来替他们说话吗？	Potentially
你在说什么？wdb你知道是什么意思？是只一些吃着北京喝着北京却骂北京或是没有素质的外地人，你想表达什么？	Potentially
这是什么毒？只毒男的不毒女的？这是女权主义者炼的吗	Potentially
那些说亚裔没被歧视的是蠢还是坏还是又蠢又坏？	Potentially
我反正还是那个观点，说东方人种族歧视是他妈21世纪最大的笑话，东方人把黑人当奴隶买卖吗？东方人圈养黑人去摘棉花吗？东方人对黑人动过私刑吗？东方人把黑人关进动物园给人看吗？东方人搞过种族隔离吗？东方人限制过黑人的投票权吗？	Potentially
您认为举重就是摈弃了女性特征咯？？？娇柔女性才是女性咯？我可以认为您这是直男癌吗？	Potentially
我喜欢看大象用鼻子走路，6难道用鼻子走路的大象就会变多？说艾滋病问题我倒是同意，但是这跟腐女喜欢看gay有什么关系？难道她们还去亲自撮合男男了？	Potentially
浙江的对外歧视还好，哪里不歧视呢？	Potentially
没事，黄左说了，白人歧视亚裔又如何？	Potentially
生那么多孩子怪谁？对不起河南本就是人口大省，你这句话让人恶心	Potentially
祖辈被白人当奴隶当牛马，后辈不应当以怨报怨吗？就是要把美国搞乱搞脏，	Potentially
怎样把白人打入歧视链底层？[机智]	Potentially
这些女人都是什么垃圾货色？？我就想知道她们的父母作何感想呢？？	Potentially
北京的好人和坏人是两个极端，好的很好，坏的比其他地方都坏，是心肠特别坏的那种，不知道他当初是被人欺负了然后变得心理扭曲？	Potentially
因为只有两广人喜欢没事打架玩啊……你以为东北人会在街头打架吗？	Potentially
首先我一开始很素质的说话你一上来就喷其次你们确实是觉得恶心不恶心不管我的事就是看不惯你这种人 再者黑人不带脏字这种话难道没有听过吗？不然真是素质黑 然后的话教养是个好东西	Potentially
就是歧视黑人能咋地? 就歧视了	Potentially
地图炮不是不行啊，你黑河南人还举个例子，黑东北山东人例子都不举的？东北人杀你全家了？还是山东人把你绿了？	Potentially
当美国人看见亚洲人的打骂教育干与是因为是黄种人吗?	Potentially
东北人偷香蕉是没素质，广西人砸车就是真血性？qndy的吧，都是渣滓，还非要分个高下	Potentially
几十年前美国政府歧视黑人，因为给人起来暴动了惹出大事了所以就不应该向黑人们道歉给与他们相应的权利？	Potentially
还有什么直男直女，哎，现在的人是都弯了吗？明明直就是指异性恋啊，为什么成讽刺人的了？	Potentially
那白人日黑人奴隶是怎么回事？天龙人把女帝这样的当性玩具而已	Potentially
嗷，你非要这么说的话，女杀男的也不少，您这是要用魔法打败魔法？	Potentially
